{
    "_id": "43dcecc9-724c-4062-ac8f-402621f18485",
    "name": "Hotel Santa Marta",
    "type": "ACCOMMODATION",
    "uri": "http://localhost:8080/products/43dcecc9-724c-4062-ac8f-402621f18485",
    "supplierId": "cd96b919-d54d-43ca-b648-b90153def1b2",
    "_class": "com.omega.bioway.ProductSearch.crosscutting.entities.Product"
 } 